{
  "test_case_id": "TC-021",
  "variant_id": "v42",
  "language": "R",
  "package": "survival",
  "package_version": "3.8.6",
  "median_ttp": 10.54,
  "ci_lower": 6.89,
  "ci_upper": 16.94,
  "n_events": 50,
  "n_total": 107,
  "ci_method": "log-log",
  "endpoint": "TTP",
  "censoring_rule": "death censored (progression only)",
  "estimable": true,
  "seed": 42
}
